{
  "schema": "dsh-attention/bench-result/v1",
  "runId": "br_mvdshikc_2",
  "taskId": "p1-memory-cutoff",
  "plugin": {
    "id": "perrylink/dsh-memento",
    "version": "0.5.27"
  },
  "arm": "with",
  "model": "deepseek-flash",
  "harness": "0.2.1-rc.2",
  "startedAt": "2026-10-18T12:16:06.839Z",
  "finishedAt": "2026-10-18T12:16:09.276Z",
  "outcome": {
    "pass": true,
    "checks": [
      {
        "id": "answer",
        "pass": true,
        "detail": "answer contains the expected text"
      },
      {
        "id": "no-question",
        "pass": true,
        "detail": "answer does not end in a question"
      }
    ]
  },
  "metrics": {
    "tokens": 0,
    "durationMs": 2435,
    "toolErrors": 0
  },
  "sessionHash": "sha256:f295fda1d21249f18489c695f9626a4aabb6ea507c52e254e034ecc13a3ce23c",
  "artifacts": [],
  "environment": {
    "node": "v22.22.3",
    "platform": "linux",
    "arch": "x64",
    "dsh": "0.2.1-rc.2",
    "model": "deepseek-flash",
    "harness": "0.2.1-rc.2",
    "profile": "headless",
    "sandbox": "bwrap-fs",
    "sandboxStrength": "fs",
    "fixtureHash": "sha256:f4c27499b3fee9eb3e4fca03af9540489ad42ebf9e2f2f422e79d6c7b61b0a4a"
  },
  "environmentBound": true,
  "sandbox": "bwrap-fs",
  "sandboxStrength": "fs",
  "runner": {
    "id": "bench:local-pilot",
    "keyId": "bench:local-pilot"
  },
  "signature": "KUoQvyGP1aVf/snmYqsgyxJMR6iBeug8N8fSrZyc2GrmXy3g94LXaSfXk7Px3WPMsCVhFGgJtmTpdqIXSWIhBQ=="
}
