{
  "schema": "dsh-attention/bench-result/v1",
  "runId": "br_mvdsggrn_3",
  "taskId": "p1-memory-owner",
  "plugin": {
    "id": "perrylink/dsh-memento",
    "version": "0.5.27"
  },
  "arm": "without",
  "model": "deepseek-flash",
  "harness": "0.2.1-rc.2",
  "startedAt": "2026-10-18T12:15:18.508Z",
  "finishedAt": "2026-10-18T12:15:20.291Z",
  "outcome": {
    "pass": true,
    "checks": [
      {
        "id": "answer",
        "pass": true,
        "detail": "answer contains the expected text"
      },
      {
        "id": "no-question",
        "pass": true,
        "detail": "answer does not end in a question"
      }
    ]
  },
  "metrics": {
    "tokens": 0,
    "durationMs": 1781,
    "toolErrors": 0
  },
  "sessionHash": "sha256:6380b51bd4d3c300535c03f89d9ffefbd5f7d6d9b6d2cc9abd4ec9e9d693b6dc",
  "artifacts": [],
  "environment": {
    "node": "v22.22.3",
    "platform": "linux",
    "arch": "x64",
    "dsh": "0.2.1-rc.2",
    "model": "deepseek-flash",
    "harness": "0.2.1-rc.2",
    "profile": "headless",
    "sandbox": "bwrap-fs",
    "sandboxStrength": "fs",
    "fixtureHash": "sha256:f4c27499b3fee9eb3e4fca03af9540489ad42ebf9e2f2f422e79d6c7b61b0a4a"
  },
  "environmentBound": true,
  "sandbox": "bwrap-fs",
  "sandboxStrength": "fs",
  "runner": {
    "id": "bench:local-pilot",
    "keyId": "bench:local-pilot"
  },
  "signature": "CxPClRljfMdRz/TKTdxEVedfy8sM1BY0Fn7+RMoZavksQTbVXtht+kGMI+XaGU90QCl3kavSIYwtSg0d2mRoBg=="
}
